<?xml version="1.0" ?>
<!DOCTYPE qsp-config SYSTEM "qsp-config.dtd"> 
<qsp-config>
 <logger name="qsp">
    <log-listener name="simple" type="simple" />
    <!-- log-listener name="rotate" type="rotate" 
         filename="/tmp/qsp.log" window="86400" copies="10" / -->
 </logger>

 <mux name="acme.mux" logger="qsp" realm="acme">
  <channel name="acme.channel" 
          class="org.jpos.iso.ASCIIChannel" 
          packager="org.jpos.iso.ISO87APackager"
          host="localhost" port="8000"
          logger="qsp" realm="acme"
	  connect="no" >
   <filter class="org.jpos.iso.filter.XSLTFilter" direction="outgoing">
    <property name="xsltfile" 
              value="src/ext/org/jpos/apps/qsp/msg/outgoing.xsl" />
    <property name="reread" value="yes" />
   </filter>
   <filter class="org.jpos.iso.filter.DelayFilter" direction="incoming">
    <property name="delay" value="1000" />
   </filter>
  </channel>
  <!--request-listener class="org.jpos.apps.qsp.Connector"
    logger="qsp" realm="acme.mux.request.listener">
    <property name="destination-mux" value="acme.mux" />
    <property name="timeout" value="15000" />
  </request-listener -->
 </mux>

 <task class="org.jpos.apps.qsp.task.Sender" logger="qsp" realm="acme-sender">
  <property name="mux" value="acme.mux" />
  <property name="message" value="src/ext/org/jpos/apps/qsp/msg/0800.xml" />
  <property name="wait-for-response" value="15000" />
  <property name="initial-delay" value="1000" />
  <property name="delay" value="10000" />
 </task>

</qsp-config>
